{
  "$schema": "https://json-schema.org/draft/2020-12/schema",
  "$id": "https://github.com/8Dionysus/aoa-techniques/mechanics/experience/parts/scope-boundary/schemas/scope_boundary_technique_note_v1.json",
  "title": "Scope Boundary Technique Note V1",
  "type": "object",
  "additionalProperties": false,
  "required": [
    "created_at",
    "effect",
    "evidence_refs",
    "id",
    "kind",
    "notes",
    "owner_repo",
    "status",
    "technique",
    "version"
  ],
  "properties": {
    "created_at": {
      "type": "string",
      "minLength": 1,
      "format": "date-time"
    },
    "effect": {
      "type": "string",
      "minLength": 1
    },
    "evidence_refs": {
      "type": "array",
      "items": {
        "type": "string",
        "minLength": 1
      },
      "minItems": 1
    },
    "id": {
      "type": "string",
      "minLength": 1
    },
    "kind": {
      "type": "string",
      "minLength": 1,
      "const": "scope_boundary_technique_note_v1"
    },
    "notes": {
      "type": "string",
      "minLength": 1
    },
    "owner_repo": {
      "type": "string",
      "minLength": 1,
      "const": "aoa-techniques"
    },
    "status": {
      "type": "string",
      "minLength": 1,
      "enum": [
        "active",
        "allowed",
        "applied",
        "blocked",
        "completed",
        "draft",
        "failed",
        "held",
        "passed",
        "proposed",
        "rejected",
        "rolled_back",
        "sealed"
      ]
    },
    "technique": {
      "type": "string",
      "minLength": 1
    },
    "version": {
      "type": "string",
      "minLength": 1,
      "const": "1.1.0"
    }
  }
}
