{
  "created_at": "2026-04-22T00:00:00Z",
  "effect": "clean_escalation",
  "evidence_refs": [
    "generated/multi_office_train_clean_flow/release_train.json"
  ],
  "id": "scope_boundary_technique_note_v1_example",
  "kind": "scope_boundary_technique_note_v1",
  "notes": "Example artifact for scope_boundary_technique_note_v1.",
  "owner_repo": "aoa-techniques",
  "status": "draft",
  "technique": "scope_boundary_probe",
  "version": "1.1.0"
}